<?xml version="1.0" encoding="UTF-8"?>
<root xmlns:xsi="http://www.w3.org/2001/XMLSchema-instance" xsi:noNamespaceSchemaLocation="XMLSchemaCWM4U0.xsd">
<Elofizetok>
    <Elofizeto ElofizetoId="1" ElofizetesId="1">
        <Nev>Gábor</Nev>
        <Utca>Eper</Utca>
        <Hazszam>1</Hazszam>
    </Elofizeto>
    <Elofizeto ElofizetoId="2" ElofizetesId="2">
        <Nev>Bence</Nev>
        <Utca>Eper</Utca>
        <Hazszam>2</Hazszam>
    </Elofizeto>
    <Elofizeto ElofizetoId="3" ElofizetesId="3">
        <Nev>Lajos</Nev>
        <Utca>Eper</Utca>
        <Hazszam>3</Hazszam>
    </Elofizeto>
</Elofizetok>
<Elofizetesek>
    <Elofizetes  ElofizetesId="1">
        <Lapid>1</Lapid>
        <Eloid>1</Eloid>
        <Elofizetok>
            <Db>1</Db>
        </Elofizetok>
    </Elofizetes>
    <Elofizetes ElofizetesId="2">
        <Lapid>2</Lapid>
        <Eloid>2</Eloid>
        <Elofizetok>
            <Db>2</Db>
        </Elofizetok>
    </Elofizetes>
    <Elofizetes ElofizetesId="3">
        <Lapid>3</Lapid>
        <Eloid>3</Eloid>
        <Elofizetok>
            <Db>3</Db>
        </Elofizetok>
    </Elofizetes>
</Elofizetesek>
<Kihordok>
    <Kihordo Kihordoid="1">
        <Knev>Endre</Knev>
        <Kbeosztas>1</Kbeosztas>
        <Varos>Miskolc</Varos>
    </Kihordo>
    <Kihordo Kihordoid="2">
        <Knev>Lajos</Knev>
        <Kbeosztas>2</Kbeosztas>
        <Varos>Budapest</Varos>
    </Kihordo>
    <Kihordo Kihordoid="3">
        <Knev>Milán</Knev>
        <Kbeosztas>3</Kbeosztas>
        <Varos>Miskolc</Varos>
    </Kihordo>
</Kihordok>
<Szerkesztok>
    <Szerkeszto SzerkesztoId="1">
        <Sznev>Imre</Sznev>
        <Szbeosztas>Sport elemzo</Szbeosztas>
        <Szadatok>Egyetemi végzettség</Szadatok>
    </Szerkeszto>
    <Szerkeszto SzerkesztoId="2">
        <Sznev>Ferenc</Sznev>
        <Szbeosztas>Riporter</Szbeosztas>
        <Szadatok>Középiskolai végzettség</Szadatok>
    </Szerkeszto>
    <Szerkeszto SzerkesztoId="3">
        <Sznev>Erik</Sznev>
        <Szbeosztas>Designer</Szbeosztas>
        <Szadatok>Egyetemi végzettség</Szadatok>
    </Szerkeszto>
</Szerkesztok>
<Lapok>
    <Lap LapId="1">
        <Cim>Nemzeti sport</Cim>
        <Tema>Sport</Tema>
        <Havi>6000</Havi>
        <Negyedeves>17850</Negyedeves>
        <Szid>1</Szid>
        <Kid>1</Kid>
    </Lap>
    <Lap LapId="2">
        <Cim>PC World</Cim>
        <Tema>Informatika</Tema>
        <Havi>1800</Havi>
        <Negyedeves>5385</Negyedeves>
        <Szid>2</Szid>
        <Kid>2</Kid>
    </Lap>
    <Lap LapId="3">
        <Cim>Mi Újság</Cim>
        <Tema>Hírek</Tema>
        <Havi>1500</Havi>
        <Negyedeves>5000</Negyedeves>
        <Szid>3</Szid>
        <Kid>3</Kid>
    </Lap>
</Lapok>
<E-Ek>
    <E-E ElofizetoId="1" ElofizetesId="1">
    </E-E>
    <E-E ElofizetoId="2" ElofizetesId="2">
    </E-E>
    <E-E ElofizetoId="3" ElofizetesId="3">
    </E-E>
</E-Ek>
<L-Kk>
    <L-K LapId="1" Kihordoid="1">
    </L-K>
    <L-K LapId="2" Kihordoid="2">
    </L-K>
    <L-K LapId="3" Kihordoid="3">
    </L-K>
</L-Kk>
<L-Szk>
    <L-Sz LapId="1" SzerkesztoId="1">
    </L-Sz>
    <L-Sz LapId="2" SzerkesztoId="2">
    </L-Sz>
    <L-Sz LapId="3" SzerkesztoId="3">
    </L-Sz>
</L-Szk>
<E-Lk>
    <E-L LapId="1" ElofizetesId="1">
        <Ajandek>Nincs</Ajandek>
    </E-L>
    <E-L LapId="2" ElofizetesId="2">
        <Ajandek>Van</Ajandek>
    </E-L>
    <E-L LapId="3" ElofizetesId="3">
        <Ajandek>Nincs</Ajandek>
    </E-L>
</E-Lk>
</root>